{
  "$schema": "https://json-schema.org/draft/2020-12/schema",
  "$id": "https://github.com/steveprudhomme/GNUQuebecEpicerie/raw/main/schema/flyer.schema.json",
  "title": "GNUQuebecEpicerie Flyer",
  "type": "object",
  "additionalProperties": false,
  "required": [
    "schema_version",
    "flyer_id",
    "retailer_id",
    "store_id",
    "valid_from",
    "valid_to",
    "retrieved_at",
    "source_urls",
    "offers"
  ],
  "properties": {
    "schema_version": {"type": "string", "const": "1.0"},
    "flyer_id": {"type": "string", "minLength": 1},
    "retailer_id": {"type": "string", "enum": ["superc", "iga"]},
    "store_id": {"type": "string", "minLength": 1},
    "published_at": {"type": ["string", "null"], "format": "date-time"},
    "valid_from": {"type": "string", "format": "date"},
    "valid_to": {"type": "string", "format": "date"},
    "retrieved_at": {"type": "string", "format": "date-time"},
    "source_urls": {
      "type": "array",
      "minItems": 1,
      "items": {"type": "string", "format": "uri"}
    },
    "offers": {
      "type": "array",
      "items": {"$ref": "offer.schema.json"}
    }
  }
}
